speaker,line
Patient,"but I still have no conflict. That, to me, is when I am following my feelings. And in everyday life the small little decisions, the small little things to do don't come out that clear at all. So many conflicts come with them."
Therapist,"Mhm, that’s right"
Patient,Is this natural?
Therapist,"Although you are saying – uh, I expect it is – but, but you’re saying too that you know perfectly well the feeling within yourself that occurs when you are really doing something that's right for you."
Patient,I do. I do. And I miss that feeling other times. And it's right away a clue to me.
Therapist,"Mhm. You can really listen to yourself sometimes and realize, ""Oh no, this isn't the right feeling. This isn't – this isn’t the way I would feel if I was doing what I really wanted to do."""
Patient,"But yet, many times I will go along and do it anyway. And say, ""Oh well, I'm in the situation now, I'll just remember next time."" I mentioned this word a lot in therapy and most therapists grin at me or giggle or something when I say ""utopia,"" but when I do follow a feeling and I feel this good feeling inside of me, that's sort of utopia. That's what I mean. That's the way I like to feel whether it's a bad thing or a good thing. But I feel right about me. This is what I wanna..."
Therapist,"I, I sense that in those utopian moments, you really feel kind of whole. You feel all in one piece."
Patient,"Yes. Yeah, it gives me a choked up feeling when you say that because I don't get that as often as I'd like. haha. I like that whole feeling. That's real precious to me."
Therapist,"I expect none of us get it as often as we'd like, but I really do understand it. Mhm, that really does touch you, doesn't it?"
Patient,"Yeah, and you know what else I was just thinking? I – I feel dumb saying it uh - that all of a sudden while I was talking to you I thought, ""Gee, how nice I can talk to you and I want you to approve of me and I respect you, but I miss that my father couldn't talk to me like you are."" I mean, I'd like to say, ""Gee, I'd like you for my father."" I don't even know why that came to me. haha."
Therapist,You look to me like a pretty nice daughter. But you really do miss the fact that you- you couldn't be open with your own dad.
Patient,"Yeah, I couldn't be open, but I, I wanna blame it on him. I think I’m more open than he'd allow me. He would never listen to me talk like you are and not disapprove, not lower me down. I thought of this the other day. Why do I always have to be so perfect? I know why. He always wanted me to be perfect. I always had to be better and uh... yeah, I miss that."
Therapist,"You were just trying like hell to be the girl he wanted you to be. C59 Yet at the same time, rebelling."
Therapist,That's right. Sure.
Patient,"Like I almost gloated writing him a letter the other day and telling him I am a waitress, which I expect him to disapprove of. I go out at nights and I almost gloated hitting him back - like, ""Now how do you like me?"" And yet, I really want acceptance and love from him. I mean, I know he loves me."
Therapist,"So you slap at him and say, ""This is what I am, now see."""
Patient,Yeah.
Therapist,But you- yeah
Patient,"""You raised me, how do you like it?"" But do you know what I want him to say? ""I knew this was you all along, honey, and I really love you."""
Therapist,"Oh, I see. You really feel badly that you think there is very little chance he will say that."
Patient,"No. He won't. He doesn't hear. I went back home to him about two years ago, really wanting to let him know I loved him although I’ve been afraid of him. And he doesn't hear me. He just keeps saying things like, ""Honey, you know I love you. You know I have always loved you."" He doesn't hear."
Therapist,"That was... He’s never really known you and loved you and this, somehow, is what brings the tears inside."
Patient,"I don't know what it is. You know, when I talk about it, it feels more flip. If I just sit still a minute, it feels like a great big hurt down there. That I uh, feel cheated."
Therapist,"Mhm. Mhm. It is much eas... It’s much easier to uh be a little flip, because then you don't feel that big lump inside of hurt."
Patient,"Mhm. And again, that's a hopeless situation. I tried working on it, and uh, I feel it's something I have to accept. My father just isn't the type of man I'd really like. I'd like somebody more understanding and caring. He cares, but not in the way that we can cooperate or communicate."
Therapist,"Mhm. You feel “nope” that, ""I am permanently cheated."""
Patient,"Mhm. That is why I like substitutes. Like I like talking to you and I like men that I can respect. Doctors, and I keep sort of maybe underneath a feeling like we’re real close, you know, and it’s sort of like a substitute father."
Therapist,I don't feel that's pretending.
Patient,"Well, you are not really my father hahaha."
Therapist,"No, I meant about the real close business."
Patient,"Well, see, I sort of feel that's pretending too, because I can't expect you to feel very close to me. You don't know me that well."
Therapist,"Well, all I can do is what I am feeling- that is I feel close to you in this moment."
Patient,"[The remainder is not on the film – only on audio recording] Well, O.K., I'd just like more of it I guess."
Therapist,"Do you feel as though that's a big need, that it would take a lot of caring and a lot of understanding to fill it up?"
Patient,Exactly. And I have been so busy trying to get rid of my neurosis. I'd like to have this one neurosis filled. I'd like to just find someone who is going to love me like a father. I even want this in boyfriends. I always want to get an older man that's caring and more mature and not so flip.
Therapist,"One of the things you really deeply want is to find a father whom you would love and respect and who would really like you as you are, and not to just like perfection."
Patient,"That's right. And it seems ironic that since I have been away from my husband, the only type of man I go out with are the kind I don't respect - are the young, flip, not caring, 'smart aleck' kind of guy. Not somebody that's really, you know, that I can respect. That seems like such a big thing."
Therapist,"The phrase that comes to my mind - I don't know if it is appropriate or not - you're slapping your father in the face, aren't you?"
Patient,Oh? By wanting mature men?
Therapist,No. By going out with those who are quite unlike the ones you'd really want.
Patient,But I don't mean to. I don't understand why they keep coming around.
